<?xml version="1.0" encoding="UTF-8"?>
<quiz xmlns="http://www.cs.manchester.ac.uk/pgt/COMP60411/examples/quiz"
 xmlns:xsi="http://www.w3.org/2001/XMLSchema-instance"
 xsi:schemaLocation="http://www.cs.manchester.ac.uk/pgt/COMP60411/examples/quiz quiz.xsd">
    <title>Foo</title>
    <expr>
        <plus>
            <number>1</number>
            <number>2</number>
        </plus>
    </expr>    
    <expr>
        <plus>
            <number>1</number>
            <dividedBy>
                <number>5</number>
                    <times>
                        <number>7</number>
                        <number>8</number>
                    </times>
            </dividedBy>
        </plus>
    </expr>
    <expr>
        <dividedBy>
            <number>7</number>
            <times>
                <number>1</number>
                <times>
                    <number>7</number>
                    <plus>
                        <number>8</number>
                        <plus>
                            <number>9</number>
                            <minus>
                                <number>10</number>
                                <plus>
                                    <number>11</number>
                                    <number>12</number>
                                </plus>
                            </minus>
                        </plus>
                    </plus>
                </times>
            </times>
        </dividedBy>
    </expr>
</quiz>